Title,Rating,Overview
She-Ra: Princess of Power,6.8,"Princess Adora raises her magic sword and becomes She-Ra, the most powerful woman in the universe, to aid her friends in defeating the Evil Horde so their planet Etheria can be free."
Fire Country,7.2,A young convict joins a firefighting program looking for redemption and a shortened prison sentence. He and other inmates work alongside elite firefighters to extinguish massive blazes across the region.
B.E. Rojgaar,9.0,"An aspirational tale of three engineer friends, Akshay, Piyu and Papdya, who go on a journey from being 'be rojgaar' to creating 'rojgaar' by stumbling on a start-up idea and going back to their roots."
Alone,8.4,"Ten survival ""experts"" attempt to survive alone. The winner receives $500,000."
Spiral,8.5,Follows criminal investigations in Paris from all the different points of view of those involved.
Static Shock,7.3,"In the city of Dakota, a teenage boy with electricity based powers, with the help of his inventive friend, fights crime as a superhero."
Romanzo criminale - La serie,8.5,"This crime drama, set in Rome in the 1970s, tells the story of the Banda della Magia, a prolific Italian crime family responsible for some of the country's most violent crimes."
Memories of the Alhambra,7.8,"After suffering a setback following a friend's betrayal Yoo Jin Woo travels to Spain on a business. There, he stays at an old hostel owned by a former classical guitarist Jung Hee Joo. The two get entangled in a mysterious incident."
Duckman: Private Dick/Family Man,7.8,"A crass, womanizing duck works as a private eye with his level-headed pig sidekick, all the while raising a family as a single dad."
Moone Boy,8.1,Martin Moone is a young boy who relies on the help of his imaginary friend Sean to deal with the quandaries of life in a wacky small-town Irish family circa 1990.
Famous in Love,6.7,A college student's big break in a Hollywood blockbuster leaves her navigating through an undeniable chemistry.
The Streets of San Francisco,7.3,"A veteran cop with more than twenty years of experience is teamed with a young Inspector to solve crimes in San Francisco, California."
The Sarah Jane Adventures,7.4,"Investigative journalist Sarah Jane Smith, with the help of her adopted son, his friends, and an intelligent supercomputer, combats evil alien forces here on Earth."
The Last Hour,7.2,"A mysterious young shaman, on the run protecting a secret gift, joins hands with a seasoned city cop to hunt down a dangerous figure from his dark past. But when he falls for the cop's young daughter, he is torn between duty and love."
The Other Me,9.0,"A series of murders alarm the police authorities, as strange symbolisms are traced to every crime scene. The eccentric professor of criminology Dimitris Lainis is asked to shed some light on the mystery."
McLeod's Daughters,7.3,"Estranged sisters Claire and Tess are reunited after 20 years when they inherit their family's cattle station, ""Drover's Run"", in the outback of South Australia, following their father's death."
Calls,7.7,"Told through a series of interconnected phone conversations, it chronicles the mysterious story of a group of strangers whose lives are thrown into disarray in the lead-up to an apocalyptic event."
Mind of Mencia,3.1,"Carlos Mencia is speaking his mind and taking no prisoners. Enter the Mind of Mencia and get ready for a merciless mix of up close stand-up, unconventional street interviews, and shocking commercial parodies."
Carmen Sandiego,7.9,"The adventures of Carmen Sandiego, a globe-hopping master thief."
Somewhere Between,6.2,"A local news producer is given one chance to relive a deadly week and stop a serial killer. If she fails, she'll lose her daughter forever."
I'm Not a Robot,8.0,"Kim Min Gyu has wealth and success, but lives an isolated life due to his allergy of people. He then meets and falls in love with a girl who is pretending to be a robot for her ex-boyfriend, a genius robots professor."
Capital,7.0,"The story of life of Naghi Ma'mouli, his wife Homa Sa'adat, their children Sara and Nika, his Alzheimer's father Panjali, his cousin Arastou, his sister Fahimeh, his sister's husband ...                See full summary »"
Ek Thi Begum,8.6,"Inspired by true events - 'Ek Thi Begum', is the untold revenge story of Ashraf a.k.a Sapna."
Ramsay's Kitchen Nightmares,7.6,British reality series in which world-renowned chef Gordon Ramsay visits struggling restaurants in an effort to help them succeed.
The Thundermans,5.7,"These siblings with superpowers might be twins, but they are very different indeed."
The Twilight Zone,7.2,"This second revival of The Twilight Zone (1959) presents tales of suspense, fantasy, science fiction and horror."
Charles in Charge,6.1,"Charles, a college student, is a live-in housekeeper in the Powell household. Charles, along with his friend Buddy, attempts to juggle his studies, friendships, and duties to the family."
Blue Lights,8.2,"Follows rookie police officers working in Belfast, a city in which being a frontline response cop comes with unique pressures and dangers."
The Bob Newhart Show,8.1,"The professional and personal misadventures of a psychologist and his family, patients, friends and colleagues."
Benidorm,7.5,British comedy series following holidaymakers at the Solana Resort in Benidorm. Hilarity ensues as guests try to get value for their Euros.
Strangers with Candy,8.1,A 46-year-old ex-drug addict returns to high school as a freshman.
Blue's Clues,6.9,Blue is a puppy who puts her paw prints on three clues. Steve or Joe has to deduce the clues (with the help of off-screen children) to figure out what Blue wants to do.
Ikinci Bahar,8.7,"One day, a mother of two children, Hanim starts to work in ""Antep Sofrasi""; a Turkish kebab restaurant which a father of three girls Ali Haydar owns. While he is thickheaded, a bit angry, ...                See full summary »"
Friends with Better Lives,7.0,A comedy centered around six 30-something friends who each think the other has it better.
Helluva Boss,8.2,"In Hell, imp Blitzø runs an assassin business targeting the world of the living, using a spell book borrowed from a prince of Hell. With employees Moxxie, Millie, and Loona, they attempt to survive each other while keeping business afloat."
Deep State,7.1,"What happens when a man who believes he has retired from MI6 is called back to do one more job to regain his life, only to discover that this job may mean he has no life to go back to."
Wanted,7.6,Two strangers are prime suspects in a murder.
Common Law,7.8,"Centers on cops Wes Mitchell and Travis Marks, who have a problem, each other. So their captain sends them to couples therapy."
Kickin' It,6.5,A once-in-a-generation young karate fighter named Jack joins the Wasabi warriors.
Kin,7.7,Kin tells the story of a fictional Dublin family embroiled in gangland war and speaks to the enduring unbreakable bonds of blood and family.
Sexify,6.5,"To build an innovative sex app and win a tech competition, a sexually inexperienced student and her friends must explore the daunting world of intimacy."
Call My Agent Bollywood,5.8,"From pulling off casting coups to calming celebrity egos, the drama never stops for four Mumbai talent agents hustling to save their sinking company."
Trial & Error,7.9,"A spoof of crime documentaries about the arrest and trial of a beloved poetry professor from a small town in South Carolina, who is accused of brutally murdering his wife, and the young Northeastern lawyer hired to defend him."
Pandora,4.3,"Set in the year 2199, a young woman who has lost everything finds a new life at Earth's Space Training Academy where she learns to defend the galaxy from intergalactic threats."
Unsolved Mysteries,8.2,"Combines dramatic re-enactments, interviews and updates, to tell stories of real mysteries, from human to the supernatural."
8 Out of 10 Cats Does Countdown,8.2,A raunchy spoof edition of Countdown (1982) with the stars of 8 Out of 10 Cats (2005).
Manhattan Love Story,7.0,The unfiltered internal monologues of a young man and a young woman are exposed as they begin a new relationship together.
Trigger Point,6.4,"Drama series following Lana Washington, an experienced bomb disposal officer working for the Metropolitan Police."
Jonas,4.6,The show follows the Jonas Brothers through fun and unusual situations as they try to live ordinary lives.
Bandon Mein Tha Dum!,8.8,"Bandon Mein Tha Dum is a documentary series which follows the Border-Gavaskar Trophy Test series of 2020-21 which resulted in India stunningly defeating Australia at their home turf of Gabba, where they hadn't lost a test match in 32 years"
Gang Related,7.5,"As kid, Ryan Lopez got connected to gang boss Javier Acosta. He's now detective in LAPD's Gang Task Force. While secretly passing info on to Javier, he's a good cop 95% of the time."
Grown-ish,6.6,"A spinoff of ABC's ""Black-ish,"" Zoey Johnson is off to college and must live outside the nest, dealing with drugs, sex, and relationships along the way."
Ninjago: Masters of Spinjitzu,7.5,"When the fate of their world, Ninjago, is challenged by great threats, it's up to the ninja: Kai, Jay, Cole, Zane, Lloyd and Nya to save the world."
Home and Away,5.1,"This show chronicles the lives, loves, happiness, and heartbreaks of the residents of Summer Bay, a small coastal town just outside of Sydney, New South Wales, Australia."
City Hunter,8.1,Lee Yun-seong was trained by his father's best friend in order to get revenge on the government for killing everyone in his father's unit.
The Watch,5.5,A group of misfit cops rise up from decades of helplessness to save their corrupt city from catastrophe.
The Forsyte Saga,8.1,"Chronicles the lives of three generations of the upper-middle-class British family, the Forsytes, from the 1870s to 1920."
Hip-Hop Evolution,8.4,"MC and journalist Shad Kabango meets with Hip-Hop's biggest stars to retrace how Hip-Hop became the world's most popular music, but realizes that Hip-Hop's true legacy is something much more profound."
Leah Remini: Scientology and the Aftermath,8.9,A series featuring stories from former members of the Church of Scientology whose lives have been affected by the Church's alleged harmful practices.
The Greatest American Hero,7.3,A teacher is asked to be a superhero using a special alien suit with powers he can barely understand or control.
10 Things I Hate About You,7.2,"At Padua High, newcomers Kat and Bianca Stratford attempt to navigate the popular crowd."
Mama's Family,7.3,"Mama's Family originated with Thelma ""Mama"" Harper, and her younger sister Fran living together in Mama's house."
Flowers,8.1,Dark comedy about the eccentric members of the Flowers family. Maurice and Deborah are barely together but yet to divorce. They live with Maurice's batty mother and their maladjusted twin children.
Wild Abandon,7.1,"In the haze of a midlife crisis, an architect begins living a double life as a punk while members of his family lead their own crisis-ridden lives."
Because This Is My First Life,8.1,"Ji Ho is a single woman. She's a writing assistant of dramas. She's a strong and determined woman. Unfortunately, she has to leave her house and seeks other place to live. Her friends help her to find a roommate. That roommate is Se Hee."
Review,8.4,"In this spoof of review shows, Forrest MacNeil, a critic obsessed with his work, experiences whatever the viewers ask him to review including divorce, anonymous sex, and all manner of criminal activity."
Shaman King,8.0,"SHAMAN KING follows the adventures of a 13-year-old shaman and his teammate a samurai warrior spirit, who traverse the world fighting evil spirits and misguided shamans on their journey to be the next Shaman King."
House of Payne,3.5,A multi-generational family lives together under one roof.
The Curse of Oak Island,6.9,"Rick and Marty Lagina, two brothers from Michigan with a life-long interest in the mystery of Oak Island, renew efforts to discover the legendary treasure with sophisticated machinery."
The Emperor's New School,6.6,"Continuation of 2000's The Emperor's New Groove, showcasing Kuzco's attempts to graduate from his kingdom's school, and his former advisor Yzma's evil attempts to keep him from his goal."
Informer,7.8,A young East London man is coerced by an officer to work undercover for him.
American Odyssey,7.3,"Three families are torn apart when a stranded female soldier, a disillusioned corporate attorney and a disrespected political activist are pulled into the same shocking international military conspiracy."
The Brokenwood Mysteries,7.9,"Detective Inspector Mike Shepherd arrives on assignment in Brokenwood, a small town where memories - and animosities - run deep."
Stan Against Evil,7.3,"An aging police sheriff begrudgingly joins an alliance with a new sheriff, Evie Barret, to battle angry demons haunting their small New Hampshire town."
Bloodhounds,8.1,"In order to pay off their debt, three daring youths jump into the money-lending business while confronting the rich and powerful who prey on the weak."
McDonald & Dodds,7.5,A shy and enigmatic Detective Sergeant is partnered with a wildly ambitious Detective Chief Inspector to solve crimes in the historic city of Bath.
Fate/stay night,7.3,Amateur mage Shirou Emiya gets involved in a fight between mages using mythological heroes.
Pretty Little Liars: The Perfectionists,6.9,"Everything about the town of Beacon Heights seems perfect, but in the aftermath of the town's first murder, behind every Perfectionist hides secrets, lies and much needed alibies."
The Romanoffs,7.0,Anthology of eight stories about people who believe themselves to be descendant of the Russian Royal family.
Lucky Man,7.1,From the mind of comic book legend Stan Lee comes a bold new action crime series about a brilliant but flawed police officer with the power to control luck.
86,8.2,"The Republic of San Magnolia is at war with its neighboring country, the Empire of Giad. Both sides use unmanned drones to conduct a ""war without casualties"". The story follows Lena as she commands a squad of drones called the 86."
Somebody Feed Phil,8.3,Phil travels around the world sampling food and tradition with friends and a sense of humor.
Bakemonogatari,8.0,"Third-year high school student Koyomi Araragi is human again. Cured of his vampirism, he seeks to help other supernaturals with their problems. Koyomi becomes involved in their lives, revealing secrets in people he once knew."
For The People,7.3,"Set in the Southern District of New York Federal Court, brand-new lawyers work for both the defense and the prosecution as they handle the most high-profile and high-stakes cases in the country--all as their personal lives intersect."
Black Monday,7.4,A group of outsiders takes on the 1980s old-boys club of Wall Street.
The Vow,7.2,"A look at the experiences of the members of the NXIVM, an organization and sex cult that made headlines for being charged with sex trafficking, racketeering, and conspiracy."
Amazing Stories,7.4,"Truly amazing, fantastical, funny, and odd, and sometimes scary, sad, and endearing stories are portrayed. Many famous actors, actresses, and directors made guest appearances."
When They Cry,7.8,The story of a group of young friends and the mysterious events that occur in the rural village of Hinamizawa.
Enlisted,6.9,"Centers on Sgt. Pete Hill who, after a stint in Afghanistan, is stationed at a small military base in Florida to tackle the toughest job of all: leading his dysfunctional brothers' squad."
State of the Union,7.7,"Louise and Tom who meet in a pub immediately before their weekly marital therapy session. Each episode pieces together how their lives were, what drew them together, and what has started to pull them apart."
Q-Force,6.7,A handsome secret agent and his team of LGBTQ superspies embark on extraordinary adventures.
Living Single,7.6,"Follows the lives of several single male and female roommates and friends in 1990s Brooklyn, New York."
Seraph of the End,7.4,"In 2012, the world allegedly comes to an end at the hands of a human-made virus, ravaging the global populace and leaving only children untouched. It is at this time that vampires emerge from the recesses of the earth."
Boston Public,7.3,"The lives of 10 faculty members at a high school in Boston weave in and out of dealing with trouble-makers, having a personal life, and keeping sanity."
Pitch,7.5,A young pitcher becomes the first woman to play in the Major Leagues.
Chasing Life,7.8,"April Carver, whose world has just started to look up, is diagnosed with leukemia. With the support of her family and best friend, she might just be able to fight it."
The Crew,6.5,Life in the garage swerves off track for a NASCAR crew chief and his tight-knit racing team when a new boss steps in and shakes things up.
Annika,7.1,"Witty, enigmatic DI Annika Strandhed heads up the Marine Homicide Unit, tasked with solving murders in and around the Scottish waters."
Waking the Dead,7.9,Det. Supt. Peter Boyd leads a team of detectives who investigate unsolved murders using modern technology.
Ellen,6.1,Ellen Morgan is a neurotic bookstore owner who deals with life through comedy and extensive rambling.
Good Girls Revolt,8.1,A look at the personal and professional lives of employees at an American news magazine in the late 1960s.
Top Gear USA,5.3,"The hosts Adam Ferrara, Rutledge Wood and Tanner Foust talk about what ever you need to know about cars and in every episode they go through a list of challenges to know who chose the best ...                See full summary »"
The Innocents,6.3,"When teenagers, Harry and June, run away from their repressive families to be together, they're derailed by an extraordinary discovery--June's ability to shape-shift. A scientist tries to capture her and discover the key to her power."
Suspicious Partner,7.8,"A young woman grows close to a prosecutor as she works with him as a trainee in a murder case. However, things take a turn when she inexplicably becomes a suspect."
Dead Ringers,6.5,"The Mantle twins, identical from head to toe, are on a mission to change the way women give birth."
Awkwafina Is Nora from Queens,7.5,"With help from her dad and grandmother, Nora Lum navigates young adulthood in Flushing, New York with her cousin."
Shahmaran,5.2,"When Sahsu goes to Adana for a lecture, it's the perfect chance to face her estranged grandfather. But soon, she finds herself in the midst of a legend."
50M2,6.9,"After being betrayed by his boss, a hitman hides out in a vacant tailor shop, where he's mistaken for the late owner's son, an identity he decides to embrace."
State of Affairs,6.3,"A CIA officer is plucked from the field to become the president's daily briefer, assuming responsibility for targeting America's most critical threats while navigating the unique lifestyle that comes with such a high-powered job."
Cold Courage,5.9,Two young Finnish women in London are drawn inexorably together via the Studio - a clandestine group dedicated to bringing justice to those beyond the law.
Brockmire,8.0,"A famed Major League Baseball announcer who suffers an embarrassing, very public meltdown live on-air after discovering his beloved wife's serial infidelity, decides to reclaim his career and love life in a small town a decade later."
She,6.4,An undercover assignment to expose a drug ring becomes a timid Mumbai constable's road to empowerment as she realizes her dormant sexuality's potential.
Megas XLR,8.3,Two teenage slackers find a mecha from the future that had been lying in a New Jersey junkyard for nearly 60 years and make modifications much to the dismay of the robot's attractive creator.
The Quintessential Quintuplets,7.7,"A poor, straight A student is hired to tutor some rich quintuplets. The story is told as a flashback from a future that shows that he ends up getting married to one of them."
American Gigolo,7.0,Follows Julian Kaye after his wrongful conviction release following 15 years in prison as he struggles to find his footing in the modern-day Los Angeles sex industry and navigates his complicated relationships.
Back to Life,7.5,"After 18 years behind bars, Miri Matteson returns home and stumbles back into adult life in the claustrophobic coastal town she once knew in this half-hour comedy series."
My Next Guest Needs No Introduction with David Letterman,7.9,Comedian David Letterman interviews people he finds fascinating.
Capitani,6.6,"In a Luxembourg village where everyone is keeping secrets, gruff police inspector Luc Capitani investigates the suspicious death of a 15-year-old girl."
Luck,7.4,A television series centered around characters who are tied to the same horse-racing track.
Fruits Basket,7.9,"After her mother's death, Tohru Honda finds herself living with the Sohma family consisting of three cousins: Yuki, the 'prince charming' of their high school, Kyo the hot headed, short ...                See full summary »"
Save Me,7.7,"Nelly hasn't rested trying to find his missing daughter Jody, he won't give up, and he will do anything to find out what happened. Discovering things about him and those around him, things he never imagined."
Great Pretender,7.9,"A Japanese conman crosses paths with a French rival, and gets entangled in conspiracies and scams beyond his wildest dreams."
Suskunlar,8.3,A rising attorney finds his perfectly crafted life threatened when his long-lost childhood friends threaten to expose a dark secret from their past from Kuyudibi district in Istanbul.
Highway to Heaven,6.8,"A probationary angel, sent back to Earth, teams with an ex-cop to help people."
The X Factor,5.0,"In this American version of the hit UK show, Simon Cowell and his fellow judges search for a singer who has the ""X factor""."
La Révolution,6.6,"In a reimagined history of the French Revolution, the guillotine's future inventor uncovers a disease that drives the aristocracy to murder commoners."
The 1st Shop of Coffee Prince,8.2,"A tomboy, mistaken for a lad, maintains the deception for the sake of employment. The situation becomes complicated when her male boss begins to develop feelings for this ""boy."""
How Not to Live Your Life,8.3,"This series revolves around a neurotic twenty-nine year old man named Don. As he tries to make his way through life, his overactive mind and inappropriate behavior is always getting him into trouble."
The Soup,8.2,"From the hottest new series to the latest OMG reality TV moments, catch up on everything you missed through the lens of a sharp and hilarious commentary."
Minus One: New Chapter,7.9,"Varun and Ria realise that they still might have feelings for each other, when Varun decides to take the big step of marriage with Anisha. As they deal with their repressed feelings, we also see how they fell in love and why they broke up."
Titus,7.6,"A mechanic, Christopher Titus, along with his brother and his friends, try to deal with his father, a lewd, crude, drinking multiple divorcee."
Bad Banks,7.8,"Ambitious Jana is confronted with the unscrupulous machinations of the world of finance. Her working life is determined by egotism, the pressure to succeed and machismo. She soon has to decide how far she is prepared to go for her career."
"Eerie, Indiana",8.2,"Teenage weirdness investigator Marshall Teller adventures through his new small-town home with his friends, geeky Simon Holmes and mysterious Dash X."
Wallander,7.6,A Swedish cop in a small town by the Baltic coast.
8 Out of 10 Cats,7.7,8 Out Of 10 Cats is a cheeky and articulate comedy panel show hosted by English comedian Jimmy Carr that uses statistics and a series of opinion polls as a basis for discussion.
The Law According to Lidia Poët,7.4,"Forbidden from practicing law, a woman prepares an appeal to overturn the court's decision in this true story of Lidia Poët, Italy's first female lawyer."
Room 104,6.1,"Anthology series set in room 104 of a seemingly average American motel, each time telling a different story of the assorted guests who pass through, which can range from funny and fantastical to dramatic and horrifying."
I'm Sorry,8.0,"A seemingly-confident comedy writer, wife and mom comically exposes her inner immaturity and neuroses through unexpected life situations."
Roadies,7.4,A road crew helps with a rock band's major multi-city tour.
The Toys That Made Us,7.9,The minds behind history's most iconic toy franchises discuss the rise (and sometimes fall) of their billion-dollar creations.
Club de Cuervos,8.2,"When the patriarch of a prominent family dies, his heirs battle to determine who will gain control of his beloved soccer team: The Cuervos of Nuevo Toledo."
The Case-Book of Sherlock Holmes,8.7,"Holmes and Dr. Watson solve the mysteries of the Disappearance of Lady Frances Carfax, Thor Bridge, Shoscombe Old Place, The Boscombe Valley Mystery, The Illustrious Client and The Creeping Man."
Hell Is Other People,7.8,Unpleasant events disturb the life of an aspiring crime fiction writer when he becomes a resident of an apartment building teeming with shady neighbors.
Low Winter Sun,7.0,"Murder, deception, revenge and corruption that starts with the murder of a cop by fellow Detroit detective, Frank Agnew."
A to Z,6.7,"A chronicle of Andrew and Zelda's relationship, which lasts for eight months, three weeks, five days, and one hour."
Loudermilk,7.8,"Sam Loudermilk is a recovering alcoholic and substance-abuse counselor with a bad attitude. Although he has his drinking under control, Loudermilk discovers that when your life is a mess, getting clean is the easy part."
The Real O'Neals,7.3,A family's bond is strengthened when the youngest son tells his parents that he's gay.
Neighbours,5.6,Australian soap opera exploring the lives and relationships of the residents of Ramsay Street in Erinsborough.
Parker Lewis Can't Lose,7.9,"For a cool high school kid and his friends, thwarting authority figures and other enemies is not a problem."
