Title,Rating,Overview
Sanditon,7.7,"About Charlotte Heywood, a spirited and impulsive woman, who moves from her rural home to Sanditon, a fishing village attempting to reinvent itself as a seaside resort."
The Pretender,7.5,"A specially gifted man, with the ability to instantly master any skill, escapes from a secret testing facility and travels the country taking on different jobs and helping strangers while hiding from his kidnappers."
War of the Worlds,6.5,"Set in contemporary France, this Anglo-French reimagining of H. G. Wells' classic in the style of Walking Dead follows pockets of survivors forced to team up after an apocalyptic extra-terrestrial strike."
Black Lagoon,7.9,"A Japanese businessman, captured by modern-day pirates, is written off and left for dead by his company. Tired of the corporate life, he opts to stick with the mercenaries that kidnapped him, becoming part of their gang."
McMafia,7.6,"Alex Godman has spent his life trying to escape the shadow of his family's past. But when a murder unearths their past, Alex is drawn into the criminal underworld where he must confront his values to protect those he loves."
Itaewon Class,8.2,"An ex-con opens a street bar in Itaewon, while also seeking revenge on the family who was responsible for his father's death."
My Brilliant Friend,8.6,A woman recounts the lifelong friendship and conflicts with a girl she met at primary school in Naples during the early 1950s.
Absentia,7.2,"After being declared dead in absentia, an FBI agent must reclaim her family, identity and innocence when she finds herself the prime suspect in a string of murders."
Mr Selfridge,7.7,"Centers on the real-life story of the flamboyant and visionary American founder of Selfridge's, London's department store."
Tosh.0,7.3,Daniel Tosh provides humorous commentary on content from the Internet.
Patriot,8.3,"Follows the complicated life of intelligence officer John Tavner, whose latest assignment--to prevent Iran from going nuclear--requires him to forgo all safety nets and assume a perilous, non-official cover."
Modern Love: Mumbai,7.8,"Exploring 6 unique yet universal stories of human connection and love in its varied forms – romantic, platonic, parental, sexual, familial, marital, self love."
Reba,6.7,"Reba McEntire stars as the titular character in this smash sitcom about a single mom of three, navigating life in a Houston suburb."
Young & Hungry,7.3,A well-off young tech entrepreneur hires a feisty young food blogger to be his personal chef.
Miranda,8.2,"Socially inept Miranda always gets into awkward situations; working in her joke shop with best friend Stevie, being hounded by her pushy mother, and around her crush Gary."
The Irregulars,6.0,"Set in Victorian London, the series follows a gang of troubled street teens who are manipulated into solving crimes for the sinister Doctor Watson and his mysterious business partner, the elusive Sherlock Holmes."
Campus Diaries,8.9,Campus Diaries is a coming-of-age drama of six students at Excel University.
Chef's Table,8.5,"Chef's Table goes inside the lives and kitchens of six of the world's most renowned international chefs. Each episode focuses on a single chef and their unique look at their lives, talents and passion from their piece of culinary heaven."
The Time Traveler's Wife,7.7,"Tells the intricate love story of Clare and Henry, and a marriage with a problem... time travel."
Life in Pieces,8.0,A family comedy told through the separate stories of different family members.
Hello Mini,7.9,"A thriller drama series, revolving around Rivanah Bannerjee, an independent girl, living alone in Mumbai. She has the perfect life: doting parents, a loving boyfriend, and a great job. But ...                See full summary »"
Kenan & Kel,7.8,Kenan and Kel: two best friends who live in Chicago are always dragged down by Kenan's get rich quick schemes while orange soda-loving buddy Kel is dragged along but tends to mess things up.
Love Life,7.5,Anna Kendrick stars in a fresh take on a romantic comedy anthology series about the journey from first love to lasting
Miracle Workers,7.1,"A comedy set in the offices of Heaven Inc. When God plans to destroy the Earth, two low-level angels must convince their boss to save humanity. They bet him they can pull off their most impossible miracle yet: help two humans fall in love."
Taskmaster,9.0,"Five comedians are set tasks challenging their creativity and wit. The tasks are supervised by Alex Horne but the Taskmaster, Greg Davies, always has the final word."
Rocket Boys,8.9,"The story of two extraordinary men, Dr. Homi Jehangir Bhabha and Dr. Vikram Ambalal Sarabhai, who created history while building India's future."
The Owl House,8.5,"Accidentally sent to the world of the Boiling Isles before a trip to summer camp, a teenage human named Luz longs to become a witch and is aided by rebellious Eda and pint-sized demon King."
A Young Doctor's Notebook & Other Stories,7.8,"In the early 20th century, a young doctor arrives in a small Russian village around the time of the Russian Revolution to work in the local hospital."
The Munsters,7.8,"A family of friendly monsters have misadventures, never quite understanding why people react to them so strangely."
Galavant,8.1,A musical comedy adventure featuring a knight on a quest for love who helps a childish king to see the error of his ways.
The Walking Dead: World Beyond,4.5,The series will focus on the first generation to grow up during the zombie apocalypse.
Hometown Cha-Cha-Cha,8.4,"A big-city dentist opens up a practice in a close-knit seaside village, home to a charming jack-of-all-trades who is her polar opposite in every way."
Life's Too Short,7.5,"The show centers on Warwick Davis in his day-to-day life, complete with the frustrations he faces."
Love 101,7.4,"In 1990s Turkey, a group of teenage outcasts band together to make their beloved teacher fall in love so she'll have a reason to stay in town with them."
The Andy Griffith Show,8.4,"Widower Sheriff Andy Taylor, and his son Opie, live with Andy's Aunt Bee in Mayberry, North Carolina. With virtually no crimes to solve, most of Andy's time is spent philosophizing and calming down his cousin Deputy Barney Fife."
Gilligan's Island,7.4,Seven men and women are stranded on an uncharted island following a torrential storm.
Breakout Kings,7.2,A squad of U.S. marshals team up with cons (former fugitives) to work together on tracking down prison escapees in exchange for getting time off their sentences.
Brave New World,7.0,"In a utopia whose perfection hinges upon control of monogamy and privacy, members of the collective begin to question the rules, putting their regimented society on a collision course with forbidden love and revolution."
Truth Be Told,7.1,A true-crime podcaster tries to solve the mystery surrounding a family patriarch's death.
How to Make It in America,7.9,"A group of 20 somethings living in New York City. Ben and Cameron work on starting a fashion company, while enjoying their lives in the greatest city in the world."
Raising Dion,7.1,A widowed single mom discovers that her son has super powers and tries to figure out how to raise him safely and responsibly.
Three's Company,7.5,The misadventures of two women and one man living in one apartment and their neighbors.
Barareh Nights,8.5,Set in late 40s in Iran. When a politically exiled man (Ansari) meets strange rural people with weird actions and accents in a village called Barareh.
Murdoch Mysteries,8.2,"In the 1890s, William Murdoch uses radical forensic techniques for the time, including fingerprinting and trace evidence, to solve some of the city's most gruesome murders."
Alex Rider,7.5,"Alex Rider is an ordinary teenager enlisted to work on behalf of MI6, where he uses skills he didn't know he had to become an extraordinary spy."
Slasher,6.7,An anthology series featuring rampaging serial killers leaving carnage in their wake as their next victims fight to stay alive.
A.P. Bio,7.4,A former philosophy professor who takes a job teaching advanced placement biology uses his students to get back at the people in his life who have wronged him.
Wallander,7.8,"Unable to unsee the dark crimes he's tasked to investigate, Wallander's job comes at a cost to his family and relationships."
Spinning Out,7.6,"A figure skating Olympic hopeful's struggle to balance love, family and fragile mental health as her dream of winning takes a dizzying hold."
A Million Little Things,7.9,A group of friends becomes motivated to live fuller lives after the unexpected death of a close friend.
The Young Ones,8.2,The crazy and sometimes surreal comedic adventures of four very different students in Thatcher's Britain.
Departure,6.9,A high-octane conspiracy series that follows the mystery of Flight 716 - a passenger plane that vanishes over the Atlantic Ocean.
Dallas,7.1,"J.R. Ewing, a Texas oil baron, uses manipulation and blackmail to achieve his ambitions, both business and personal. He often comes into conflict with his brother Bobby, his arch-enemy Cliff Barnes and his long-suffering wife Sue Ellen."
Growing Pains,6.6,The misadventures of a family with a home business father and a journalist mother.
Call My Agent!,8.3,French serial about the lives and jobs of people working at a talent agency.
Shaun the Sheep,8.2,"Shaun The Sheep is a cheeky and mischievous sheep at Mossy Bottom farm who's the leader of the flock and always plays slapstick jokes, pranks and causes trouble especially on Farmer X and his grumpy guide dog, Bitzer."
Grantchester,7.9,A Cambridgeshire clergyman finds himself investigating a series of mysterious wrongdoings in his small village of Grantchester.
"Illegal - Justice, Out of Order",8.1,"Illegal is a racy legal drama that follows an idealist lawyer, Niharika Singh, taking on her powerful mentor, Janardhan Jaitley in a battle that constantly pushes the line between legal and illegal."
The Avengers: Earth's Mightiest Heroes,8.3,"After 74 villains break out of prison, Marvel's most powerful superheroes team up to capture all of them, and also to defend the Earth from widespread threats."
Yes Minister,8.7,"The Right Honorable James Hacker has landed the plum job of Cabinet Minister to the Department of Administration. At last he is in a position of power and can carry out some long-needed reforms, or so he thinks."
KILL la KILL,7.9,A young girl arrives at a school of superhumans to find out the truth behind her father's murder.
Magnum P.I.,6.2,An ex-Navy SEAL returns from Afghanistan and uses his military skills to become a private investigator in Hawaii.
Ramy,8.0,"In New Jersey, Ramy, son of Egyptian immigrants, begins a spiritual journey, divided between his Muslim community, God and his friends who see endless possibilities."
Rasbhari,2.8,"Nand is among the rush of men who pursue Shanu, the new English teacher in Meerut. When he discovers her supposed alter-ego, the sex-obsessed spirit of Rasbhari, their relationship takes a ...                See full summary »"
The Angry Video Game Nerd,8.5,A foul-mouthed nerd reviews bad video games.
Home for Christmas,7.7,"When the constant comments on her single status and society's expectations of the perfect family Christmas finally get to 30-year-old Johanne, she starts a 24-day hunt for a partner to bring home for Christmas."
Grounded for Life,7.5,Thirty-something Irish Catholic couple Sean and Claudia deal with their three children as well as Sean's judgmental father and carefree brother.
Are You Afraid of the Dark?,8.2,"A group of teenagers meet in the woods, and tell scary stories."
Giri/Haji,7.8,"A detective from Tokyo scours London for his missing brother, who's been involved with the Yakuza and accused of murder."
Inspector Avinash,8.0,"The story revolves around the super cop Avinash Mishra of Uttar Pradesh, India. Based on year 1997, the narrative takes us through his struggle of overcoming each hurdle in reaching to the ...                See full summary »"
Suburra: Blood on Rome,7.9,"In 2008, a fight over land in a seaside town near Rome spirals into a deadly battle between organized crime, corrupt politicians and the Vatican."
Resurrection,7.3,"The lives of the people of Arcadia, Missouri are forever changed when their deceased loved ones return."
TaleSpin,7.5,Baloo the Bear from The Jungle Book (1967) is cast as a 1930s Pacific Islands bush pilot.
Girl Meets World,7.1,"More than a decade after Boy Meets World (1993), Cory and Topanga Matthews are married and have two children. Their daughter, Riley, faces life lessons through her family, friends, and school--where her father is her history teacher--as her parents did when they were younger."
The Valhalla Murders,7.1,Police profiler Arnar is sent back home from Oslo to his native Iceland to investigate the country's first serial killer case. He teams up with the local senior cop Kata.
The Angry Beavers,7.2,The wacky and sometimes surreal adventures of Norbert and Daggett Beaver.
Step by Step,6.5,"Two families become one, step by step."
Scooby-Doo! Mystery Incorporated,8.1,"Scooby-Doo and the gang attempt to solve creepy mysteries in the town of Crystal Cove, a place with a history of eerie supernatural events."
Cable Girls,7.5,"Set in the 1920s, this is the story of four women from different backgrounds newly hired as operators for a phone company."
Who Killed Sara?,6.4,"Hell-bent on exacting revenge and proving he was framed for his sister's murder, Álex sets out to unearth much more than the crime's real culprit."
The Rising of the Shield Hero,7.9,"A gamer is magically summoned into a parallel universe, where he is chosen as one of four heroes destined to save the world from its prophesied doom."
Treme,8.3,"Life after Hurricane Katrina as the residents of New Orleans try to rebuild their lives, their homes, and their unique culture in the aftermath of one of the worst natural disasters in the USA."
Santa Inc.,1.7,An elf working in Santa's Workshop in the North Pole dreams of becoming Santa Claus someday.
The Wild Thornberrys,6.6,The life of an adventurous family from the point of view of an eleven-year-old girl gifted with animal language.
Angel Beats!,7.6,Rebellious teens fight in armed combat against one dispassionate girl's supernatural powers in an afterlife high school.
Tin Star,7.2,"Ex undercover UK cop turned police chief of a small town in the Canadian Rockies does what he must to defend his family from those in power whether it's the oilmen, the preachers or the gangsters."
Katla,7.0,"One year after the violent eruption of the subglacial volcano Katla, the peace and tranquility in the small town of Vik is dramatically disturbed."
Ergo Proxy,7.9,"In a post-apocalyptic future humans live in peace with androids in a domed city. However, a strange series of murders has intruded into bored inspector Re-l Mayer's life."
Hot in Cleveland,7.4,"Three middle-aged best friends from Los Angeles are flying to Paris when their plane makes an emergency landing in Cleveland. Realizing that all the norms from Los Angeles don't apply anymore, they decide to celebrate a city that values real women and stay where they're still considered hot."
Y: The Last Man,6.0,"Set in a post-apocalyptic world, Y is the last surviving male human on the planet. Based on the comic series ""Y: The Last Man."""
What's Wrong with Secretary Kim,8.1,A romance between perfect but narcissistic second generation heir and his capable assistant.
The Big C,8.1,A suburban mother faces her cancer diagnosis while trying to find humor and happiness as well.
This Is Going to Hurt,8.4,"Set on Labor Ward with all its hilarity and heart-lifting highs but also its gut-wrenching lows, the show delivers a brutally honest depiction of life as a junior doctor on the wards, and the toll the job can take back home."
The Marvelous Misadventures of Flapjack,7.8,"The comical seafaring adventures of a young, enthusiastic boy, his pirate captain mentor, and the talking whale that raised him from birth."
NYPD Blue,7.7,Detectives from NYPD's 15th Precinct investigate homicides within their precinct.
Major Crimes,7.7,"The Closer (2005) spin-off series, which follows Captain Raydor of the Los Angeles Police Department."
The Incredible Hulk,7.0,A fugitive scientist has the curse of becoming a powerful green monster under extreme emotional stress.
The Wheel of Time: Origins,7.1,Experience the Origin Stories of the Wheel of Time as they bring you deeper into the world and its vast history and subjects.
UnREAL,7.8,A behind-the-scenes look at the chaos surrounding the production of a dating competition program.
Life Unexpected,7.5,"After 15 years in foster homes, Lux decides to get emancipated, which leads to her meeting her birth parents."
Arthur,7.4,"Based on the books by Marc Brown, these are the adventures of Arthur, an 8-year-old aardvark, and his family and friends as they grow up and learn how to be good neighbors to one another."
Rabbit Hole,7.5,"John Weir, a private espionage operative, battles over the preservation of democracy in a world constantly at odds."
The Amazing Race,7.8,"Multiple teams race around the globe for $1,000,000 to 'amazing' locations."
The Equalizer,5.5,An enigmatic figure who uses her extensive skills to help those with nowhere else to turn.
Even Stevens,7.6,"The Stevens family live in Sacramento, California, where the two younger children in the family, Ren and Louis, who have opposing personalities, often clash."
Faking It,7.3,"After numerous attempts of trying to be popular two best friends decide to come out as lesbians, which launches them to instant celebrity status. Seduced by their newfound fame, Karma and Amy decide to keep up their romantic ruse."
Primeval,7.2,"When strange anomalies start to appear all over England, Professor Cutter and his team must track down and capture all sorts of dangerous prehistoric creatures from Earth's distant past and near future."
The Brady Bunch,6.8,The misadventures of a large family united when a widower and a widow marry.
Mars,7.4,The first manned mission from Earth to Mars in 2033 attempts to colonize the red planet.
The Afterparty,7.3,"When a high school reunion's afterparty ends in a death, everyone is a suspect. A detective grills the former classmates one by one, uncovering potential motives as each tells their version of the story - culminating in the shocking truth."
Siren,7.0,A coastal town known for its legend of once being home to mermaids is turned upside down when a mysterious girl appears and begins wreaking havoc.
Believe,7.1,A relationship forms between a gifted young girl and a man sprung from prison who has been tasked with protecting her from the evil elements that hunt her power.
Gentleman Jack,8.2,"A dramatization of the life of lesbian trailblazer, voracious learner, and cryptic diarist Anne Lister."
Utopia,6.7,"A group of young adults, who meet online, get a hold of a cult underground graphic novel, which not only pins them as a target of a shadowy deep state organization, but also burdens them with the dangerous task of saving the world."
Taxi,7.7,The staff of a New York City taxicab company go about their job while they dream of greater things.
Aarya,7.8,"When her world suddenly turns upside down, will Aarya become the very thing she hated?How far will she go to survive and protect her family?"
Chowder,7.4,"In Marzipan City, the young, excitable food-loving Chowder is the apprentice of Mung Daal, a very old chef who runs a catering company with his wife, Truffles and assistant, Shnitzel."
Smoke,7.1,"Set in Goa, Smoke explores the dark web of drugs, mafia, and power. With the cartels at war, who will survive?"
City on a Hill,7.6,"In early 1990s Boston, ADA, Decourcy Ward, forms an unlikely alliance with a corrupt venerated FBI veteran, Jackie Rohr. Together, they take on a case that changes the city's entire criminal justice system."
Pew News,8.8,"The Pew News team reports unbiased news in which neither Gloria or Poppy ever give their own opinion, but sometimes they do. Just don't tell Pewdiepie."
Welcome to Wrexham,8.2,"Docuseries chronicling the purchase and stewardship of Wrexham AFC, one of professional football's oldest clubs, by two Hollywood actors, Ryan Reynolds and Rob McElhenney."
Karm Yuddh,8.2,"A deadly fire accident at the Roy Group of Industries brings Bhisham Roy under the scanner, inciting a power grab where it's blood versus blood."
The Mosquito Coast,6.8,"Follows the dangerous journey of a radical idealist and brilliant inventor, Allie Fox, who uproots his family for Mexico when they suddenly find themselves on the run from the US government."
Troy: Fall of a City,4.1,"Retells the story of the 10 year siege of Troy, which occurred in the 12 or 13th century BC."
Strong Girl Bong-soon,8.2,"Do Bong-soon is a woman born with superhuman strength that comes from the long line of women possessing it. when Ahn Min Hyuk, the CEO of ainsoft, a gaming company witnesses her strength he hires her as his personal bodyguard."
The Vicar of Dibley,8.0,A boisterous female minister comes to serve in an eccentricly conservative small town's church.
Everwood,7.5,"A widowed brain surgeon from Manhattan moves his two children to the small mountain town of Everwood, Colorado."
The North Water,7.6,"A disgraced former military doctor embarks as a surgeon aboard a whaler bound for the Arctic, where his quest for redemption becomes a fight for survival."
Sesame Street,8.1,"On a special inner city street, the inhabitants, human and muppet, teach preschool subjects with comedy, cartoons, games, and songs."
Easy,6.9,"Intertwined groups of friends in Chicago fumble through the modern maze of love, sex, technology and culture."
The Boys Presents: Diabolical,6.9,A collection of animated short stories that takes place inside The Boys universe.
In the Dark,7.5,"Murphy is a hard-living, hard-drinking, disaffected twenty-something. She's also blind. Her life comes crashing down when she stumbles upon what she's sure is the lifeless body of her closest friend in the alley outside her apartment."
Mushoku Tensei: Jobless Reincarnation,8.4,"A 34-year-old Japanese NEET is run over by a speeding truck and dies. Before he knows it, he is reborn as Rudeus Greyrat, and begins a new life full of adventure."
The Dukes of Hazzard,7.1,"The adventures of the fast-drivin', rubber-burnin' Duke boys of Hazzard County."
Hinterland,7.6,"A noir crime drama set in Aberystwyth, Wales, where troubled DCI Tom Mathias solves murders while searching for redemption."
V-Wars,6.0,Dr. Luther Swann enters a world of horror when a virus is released from ice melting due to climate change.
Yu Yu Hakusho: Ghost Files,8.5,"One day, 14-year-old Yusuke Urameshi suddenly finds himself dead, having died pushing a child out of the way of oncoming traffic. Since he has such a bad personality, even the Spirit World ...                See full summary »"
Who's the Boss?,6.6,"Tony Micelli, a retired baseball player, becomes the housekeeper of Angela Bower, an advertising executive in New York. Together they raise their kids, Samantha Micelli and Jonathan Bower, with help from Mona Robinson, Angela's man-crazy mother."
Imposters,7.8,A dark comedy that focuses on a female con artist who marries people and then disappears with their money.
The Prisoner,8.5,"After he resigns, a secret agent is abducted and taken to what looks like an idyllic village, but is really a bizarre prison. His warders demand information. He gives them nothing; he only tries to escape."
The Shrink Next Door,7.1,"The story of Marty and the therapist who turned his life around - then took it over. When he meets Dr. Ike, Marty just wants to get better at boundaries. Over 30 years, he'll learn all about them - and what happens when they get crossed."
The Brink,7.7,Top U.S. government and military scramble to prevent World War 3 from happening amidst the chaos of a geopolitical crisis.
Murderville,6.9,Eccentric detective Terry Seattle teams up with clueless celebrity guest stars to investigate a series of murders in this improvisational crime comedy.
Claymore,8.0,"In a world rife with deadly creatures called ""youma"", a young silver eyed woman, Clare, works on behalf of an organization that trains female youma halfbreeds into warriors with the ability...                See full summary »"
Rascal Does Not Dream of Bunny Girl Senpai,8.1,"The seemingly normal life of Sakuta Azusagawa, a high school student changes drastically when he meets a wild bunny girl that seems to be invisible to others."
High Fidelity,7.7,"A fan of music, pop culture, and Top Five lists runs a local record store in her hometown. An adaptation of Nick Hornby's novel ""High Fidelity."""
The Life and Movies of Erşan Kuneri,6.7,"The story of erotic film producer and director, Ersan Kuneri, in the 70s and 80s."
"Midnight, Texas",7.3,"Midnight is a safe haven for those who are different, but with the presence of outsiders, the residents band together and form a strong and unlikely family."
Highschool of the Dead,7.2,High school students are overwhelmed with the start of the zombie apocalypse.
The Late Show with Stephen Colbert,7.2,"Stephen Colbert took over as host, executive producer and writer of THE LATE SHOW on Tuesday, Sept. 8, 2015. The comedy-variety-talk show is broadcast five nights a week from the Ed Sullivan theater in New York."
My Love from Another Star,8.2,"Do Min-Joon, an alien that came to our planet 400 years ago, will be able to return to his planet in 3 months, but when he meets famous actress Chun Song-Yi, all the centuries he spent distancing himself from humans come to an end."
The Looney Tunes Show,7.7,An updated iteration of the classic Looney Tunes characters focusing on their satirical misadventures living in suburbia.
