Title,Rating,Overview
Game of Thrones,9.2,"Nine noble families fight for control over the lands of Westeros, while an ancient enemy returns after being dormant for a millennia."
Breaking Bad,9.5,A chemistry teacher diagnosed with inoperable lung cancer turns to manufacturing and selling methamphetamine with a former student in order to secure his family's future.
Stranger Things,8.7,"When a young boy disappears, his mother, a police chief and his friends must confront terrifying supernatural forces in order to get him back."
The Walking Dead,8.1,Sheriff Deputy Rick Grimes wakes up from a coma to learn the world is in ruins and must lead a group of survivors to stay alive.
Friends,8.9,Follows the personal and professional lives of six twenty to thirty year-old friends living in the Manhattan borough of New York City.
Sherlock,9.1,"The quirky spin on Conan Doyle's iconic sleuth pitches him as a ""high-functioning sociopath"" in modern-day London. Assisting him in his investigations: Afghanistan War vet John Watson, who's introduced to Holmes by a mutual acquaintance."
The Big Bang Theory,8.2,A woman who moves into an apartment across the hall from two brilliant but socially awkward physicists shows them how little they know about life outside of the laboratory.
Dexter,8.7,"He's smart. He's lovable. He's Dexter Morgan, America's favorite serial killer, who spends his days solving crimes and nights committing them."
How I Met Your Mother,8.3,A father recounts to his children - through a series of flashbacks - the journey he and his four best friends took leading up to him meeting their mother.
The Office,9.0,"A mockumentary on a group of typical office workers, where the workday consists of ego clashes, inappropriate behavior, and tedium."
True Detective,8.9,"Seasonal anthology series in which police investigations unearth the personal and professional secrets of those involved, both within and outside the law."
Black Mirror,8.7,"An anthology series exploring a twisted, high-tech multiverse where humanity's greatest innovations and darkest instincts collide."
Peaky Blinders,8.8,"A gangster family epic set in 1900s England, centering on a gang who sew razor blades in the peaks of their caps, and their fierce boss Tommy Shelby."
Better Call Saul,9.0,The trials and tribulations of criminal lawyer Jimmy McGill in the years leading up to his fateful run-in with Walter White and Jesse Pinkman.
Lost,8.3,The survivors of a plane crash are forced to work together in order to survive on a seemingly deserted tropical island.
The Boys,8.7,A group of vigilantes set out to take down corrupt superheroes who abuse their superpowers.
Rick and Morty,9.1,An animated series that follows the exploits of a super scientist and his not-so-bright grandson.
Prison Break,8.3,"A structural engineer installs himself in a prison he helped design, in order to save his falsely accused brother from a death sentence by breaking themselves out from the inside."
Vikings,8.5,"Vikings transports us to the brutal and mysterious world of Ragnar Lothbrok, a Viking warrior and farmer who yearns to explore--and raid--the distant shores across the ocean."
The Mandalorian,8.7,"The travels of a lone bounty hunter in the outer reaches of the galaxy, far from the authority of the New Republic."
The Witcher,8.1,"Geralt of Rivia, a solitary monster hunter, struggles to find his place in a world where people often prove more wicked than beasts."
Westworld,8.5,"At the intersection of the near future and the reimagined past, waits a world in which every human appetite can be indulged without consequence."
House of Cards,8.7,A Congressman works with his equally conniving wife to exact revenge on the people who betrayed him.
Money Heist,8.2,An unusual group of robbers attempt to carry out the most perfect robbery in Spanish history - stealing 2.4 billion euros from the Royal Mint of Spain.
Squid Game,8.0,"Hundreds of cash-strapped players accept a strange invitation to compete in children's games. Inside, a tempting prize awaits with deadly high stakes: a survival game that has a whopping 45.6 billion-won prize at stake."
House M.D.,8.7,An antisocial maverick doctor who specializes in diagnostic medicine does whatever it takes to solve puzzling cases that come his way using his crack team of doctors and his wits.
Supernatural,8.4,"Two brothers follow their father's footsteps as hunters, fighting evil supernatural beings of many kinds, including monsters, demons, and gods that roam the earth."
Daredevil,8.6,"A blind lawyer by day, vigilante by night. Matt Murdock fights the crime of New York as Daredevil."
Modern Family,8.5,Three different but related families face trials and tribulations in their own uniquely comedic ways.
Narcos,8.8,"A chronicled look at the criminal exploits of Colombian drug lord Pablo Escobar, as well as the many other drug kingpins who plagued the country through the years."
Arrow,7.5,"Spoiled billionaire playboy Oliver Queen is missing and presumed dead when his yacht is lost at sea. He returns five years later a changed man, determined to clean up the city as a hooded vigilante armed with a bow."
The Last of Us,8.8,"After a global pandemic destroys civilization, a hardened survivor takes charge of a 14-year-old girl who may be humanity's last hope."
Suits,8.4,"On the run from a drug deal gone bad, brilliant college dropout Mike Ross finds himself working with Harvey Specter, one of New York City's best lawyers."
The Sopranos,9.2,"New Jersey mob boss Tony Soprano deals with personal and professional issues in his home and business life that affect his mental state, leading him to seek professional psychiatric counseling."
The Simpsons,8.7,The satiric adventures of a working-class family in the misfit city of Springfield.
Attack on Titan,9.1,"After his hometown is destroyed and his mother is killed, young Eren Jaeger vows to cleanse the earth of the giant humanoid Titans that have brought humanity to the brink of extinction."
Dark,8.7,"A family saga with a supernatural twist, set in a German town where the disappearance of two young children exposes the relationships among four families."
Mr. Robot,8.5,"Elliot, a brilliant but highly unstable young cyber-security engineer and vigilante hacker, becomes a key figure in a complex game of global dominance when he and his shadowy allies try to take down the corrupt corporation he works for."
South Park,8.7,"Follows the misadventures of four irreverent grade-schoolers in the quiet, dysfunctional town of South Park, Colorado."
Fargo,8.9,"Various chronicles of deception, intrigue and murder in and around frozen Minnesota. Yet all of these tales mysteriously lead back one way or another to Fargo, North Dakota."
The Flash,7.5,"After being struck by lightning, Barry Allen wakes up from his coma to discover he's been given the power of super speed, becoming the Flash, and fighting crime in Central City."
The Wire,9.3,"The Baltimore drug scene, as seen through the eyes of drug dealers and law enforcement."
Family Guy,8.2,"In a wacky Rhode Island town, a dysfunctional family strives to cope with everyday life as they are thrown from one crazy scenario to another."
Homeland,8.3,A bipolar CIA operative becomes convinced a prisoner of war has been turned by al-Qaeda and is planning to carry out a terrorist attack on American soil.
Death Note,8.9,An intelligent high school student goes on a secret crusade to eliminate criminals from the world after discovering a notebook capable of killing anyone whose name is written into it.
Loki,8.2,The mercurial villain Loki resumes his role as the God of Mischief in a new series that takes place after the events of “Avengers: Endgame.”
Lucifer,8.1,Lucifer Morningstar has decided he's had enough of being the dutiful servant in Hell and decides to spend some time on Earth to better understand humanity. He settles in Los Angeles - the City of Angels.
Brooklyn Nine-Nine,8.4,"Comedy series following the exploits of Det. Jake Peralta and his diverse, lovable colleagues as they police the NYPD's 99th Precinct."
Avatar: The Last Airbender,9.3,"In a war-torn world of elemental magic, a young boy reawakens to undertake a dangerous mystic quest to fulfill his destiny as the Avatar, and bring peace to the world."
The Lord of the Rings: The Rings of Power,7.0,"Epic drama set thousands of years before the events of J.R.R. Tolkien's 'The Hobbit' and 'The Lord of the Rings' follows an ensemble cast of characters, both familiar and new, as they confront the long-feared re-emergence of evil to Middle-earth."
Seinfeld,8.9,The continuing misadventures of neurotic New York City stand-up comedian Jerry Seinfeld and his equally neurotic New York City friends.
The Vampire Diaries,7.7,"The lives, loves, dangers and disasters in the town, Mystic Falls, Virginia. Creatures of unspeakable horror lurk beneath this town as a teenage girl is suddenly torn between two vampire brothers."
House of the Dragon,8.5,"An internal succession war within House Targaryen at the height of its power, 172 years before the birth of Daenerys Targaryen."
Ozark,8.5,"A financial advisor drags his family from Chicago to the Missouri Ozarks, where he must launder money to appease a drug boss."
American Horror Story,8.0,"An anthology series centering on different characters and locations, including a house with a murderous past, an insane asylum, a witch coven, a freak show circus, a haunted hotel, a possessed farmhouse, a cult, the apocalypse, a slasher summer camp, a bleak beach town and desert valley, and NYC."
Wednesday,8.1,"Follows Wednesday Addams' years as a student, when she attempts to master her emerging psychic ability, thwart a killing spree, and solve the mystery that embroiled her parents."
Grey's Anatomy,7.6,A drama centered on the personal and professional lives of five surgical interns and their supervisors.
Arrested Development,8.7,"Level-headed son Michael Bluth takes over family affairs after his father is imprisoned. But the rest of his spoiled, dysfunctional family are making his job unbearable."
Orange Is the New Black,8.1,"Convicted of a decade old crime of transporting drug money to an ex-girlfriend, normally law-abiding Piper Chapman is sentenced to a year and a half behind bars to face the reality of how life-changing prison can really be."
Mindhunter,8.6,"In the late 1970s, two FBI agents broaden the realm of criminal science by investigating the psychology behind murder and end up getting too close to real-life monsters."
Sons of Anarchy,8.6,A biker struggles to balance being a father and being involved in an outlaw motorcycle club.
Sex Education,8.3,A teenage boy with a sex therapist mother teams up with a high school classmate to set up an underground sex therapy clinic at school.
13 Reasons Why,7.5,"Follows teenager Clay Jensen, in his quest to uncover the story behind his classmate and crush, Hannah, and her decision to end her life."
Aspirants,9.2,It is the story of the journey of three UPSC (public service competitive exams in India) aspirants and their friendship against all odds.
Ted Lasso,8.8,"American college football coach Ted Lasso heads to London to manage AFC Richmond, a struggling English Premier League football team."
You,7.7,"A dangerously charming, intensely obsessive young man goes to extreme measures to insert himself into the lives of those he is transfixed by."
Community,8.5,A suspended lawyer is forced to enroll in a community college with an eccentric staff and student body.
Firefly,9.0,"Five hundred years in the future, a renegade crew aboard a small spacecraft tries to survive as they travel the unknown parts of the galaxy and evade warring factions as well as authority agents out to get them."
Parks and Recreation,8.6,The absurd antics of an Indiana town's public officials as they pursue sundry projects to make their city a better place.
Two and a Half Men,7.1,A hedonistic jingle writer's free-wheeling life comes to an abrupt halt when his brother and 10-year-old nephew move into his beach-front house.
The Blacklist,8.0,"A new FBI profiler, Elizabeth Keen, has her entire life uprooted when a mysterious criminal, Raymond Reddington, who has eluded capture for decades, turns himself in and insists on speaking only to her."
Hannibal,8.5,Explores the early relationship between renowned psychiatrist Hannibal Lecter and a young FBI criminal profiler who is haunted by his ability to empathize with serial killers.
The 100,7.6,"Set 97 years after a nuclear war destroyed civilization, when a spaceship housing humanity's lone survivors sends 100 juvenile delinquents back to Earth, hoping to repopulate the planet."
Scrubs,8.4,"In the unreal world of Sacred Heart Hospital, intern John ""J.D."" Dorian learns the ways of medicine, friendship and life."
The Umbrella Academy,7.9,"A family of former child heroes, now grown apart, must reunite to continue to protect the world."
Shameless,8.6,"A scrappy, feisty, fiercely loyal Chicago family makes no apologies."
True Blood,7.9,"Telepathic waitress Sookie Stackhouse encounters a strange new supernatural world when she meets the mysterious Bill Compton, a southern Louisiana gentleman and vampire."
Fringe,8.4,An F.B.I. agent is forced to work with an institutionalized scientist and his son in order to rationalize a brewing storm of unexplained phenomena.
The Punisher,8.5,"After his revenge on those who murdered his family, aimless Marine veteran Frank Castle finds a new meaning in life as a vigilante known as ""The Punisher""."
Mad Men,8.7,"A drama about one of New York's most prestigious ad agencies at the beginning of the 1960s, focusing on one of the firm's most mysterious but extremely talented ad executives, Donald Draper."
Spartacus,8.5,"The life of Spartacus, the gladiator who lead a rebellion against the Romans. From his time as an ally of the Romans, to his betrayal and becoming a gladiator, to the rebellion he leads and its ultimate outcome."
The Handmaid's Tale,8.4,"Set in a dystopian future, a woman is forced to live as a concubine under a fundamentalist theocratic dictatorship."
Futurama,8.5,"Philip J. Fry, a pizza delivery boy, is accidentally frozen in 1999 and thawed out on New Year's Eve 2999."
Heroes,7.5,Common people discover that they have super powers. Their lives intertwine as a devastating event must be prevented.
It's Always Sunny in Philadelphia,8.8,Five friends with big egos and small brains are the proprietors of an Irish pub in Philadelphia.
The X-Files,8.6,"Two F.B.I. Agents, Fox Mulder the believer and Dana Scully the skeptic, investigate the strange and unexplained, while hidden forces work to impede their efforts."
Gotham,7.8,The story behind Detective James Gordon's rise to prominence in Gotham City in the years before Batman's arrival.
New Girl,7.8,"After a bad break-up, Jess, an offbeat young woman, moves into an apartment loft with three single men. Although they find her behavior very unusual, the men support her - most of the time."
Arcane,9.0,"Set in Utopian Piltover and the oppressed underground of Zaun, the story follows the origins of two iconic League Of Legends champions and the power that will tear them apart."
Doctor Who,8.6,The further adventures in time and space of the alien adventurer known as the Doctor and their companions from planet Earth.
The Crown,8.6,Follows the political rivalries and romance of Queen Elizabeth II's reign and the events that shaped the second half of the 20th century.
Once Upon a Time,7.7,A young woman with a troubled past is drawn to a small town in Maine where fairy tales are to be believed.
Agents of S.H.I.E.L.D.,7.5,"The missions of the Strategic Homeland Intervention, Enforcement and Logistics Division."
Jessica Jones,7.9,"Following the tragic end of her brief superhero career, Jessica Jones tries to rebuild her life as a private investigator, dealing with cases involving people with remarkable abilities in New York City."
Succession,8.9,"The Roy family is known for controlling the biggest media and entertainment company in the world. However, their world changes when their father steps down from the company."
Downton Abbey,8.7,A chronicle of the lives of the British aristocratic Crawley family and their servants in the early twentieth century.
Big Little Lies,8.5,The apparently-perfect lives of upper-class mothers of students at a prestigious elementary school unravel to the point of murder when a single mother moves to their quaint California beach town.
Euphoria,8.3,"A look at life for a group of high school students as they grapple with issues of drugs, sex, and violence."
Criminal Minds,8.1,A group of criminal profilers who work for the FBI as members of its Behavioral Analysis Unit (BAU) using behavioral analysis and profiling to help investigate crimes and find the suspect known as the unsub.
Twin Peaks,8.8,An idiosyncratic FBI agent investigates the murder of a young woman in the even more idiosyncratic town of Twin Peaks.
The End of the F***ing World,8.0,"James is 17 and is pretty sure he is a psychopath. Alyssa, also 17, is the cool and moody new girl at school. The pair make a connection and she persuades him to embark on a road trip in search of her real father."
Boardwalk Empire,8.6,An Atlantic City politician plays both sides of the law by conspiring with gangsters during the Prohibition era.
Cobra Kai,8.5,"Decades after their 1984 All Valley Karate Tournament bout, a middle-aged Daniel LaRusso and Johnny Lawrence find themselves martial-arts rivals again."
The Mentalist,8.2,"A famous ""psychic"" outs himself as a fake, and starts working as a consultant for the California Bureau of Investigation so he can find ""Red John"", the madman who killed his wife and daughter."
24,8.4,Counter Terrorism Agent Jack Bauer races against the clock to subvert terrorist plots and save his nation from ultimate disaster.
Californication,8.3,"A writer tries to juggle his career, his relationship with his daughter and his ex-girlfriend, as well as his appetite for beautiful women."
That '70s Show,8.1,"A comedy revolving around a group of teenage friends, their mishaps, and their coming of age, set in 1970s Wisconsin."
Yellowstone,8.7,A ranching family in Montana faces off against others encroaching on their land.
Person of Interest,8.5,"An ex-CIA agent and a wealthy programmer save lives via a surveillance AI that sends them the identities of civilians involved in impending crimes. However, the details of the crimes, including the civilians' roles, are left a mystery."
Gossip Girl,7.5,Privileged teens living on the Upper East Side of New York can hide no secret from the ruthless blogger who is always watching.
"Love, Death & Robots",8.4,"A collection of animated short stories that span various genres including science fiction, fantasy, horror and comedy."
Fullmetal Alchemist: Brotherhood,9.1,Two brothers search for a Philosopher's Stone after an attempt to revive their deceased mother goes awry and leaves them in damaged physical forms.
Altered Carbon,7.9,"Set in a future where consciousness is digitized and stored, a prisoner returns to life in a new body and must solve a mind-bending murder to win his freedom."
She-Hulk: Attorney at Law,5.3,"Jennifer Walters navigates the complicated life of a single, 30-something attorney who also happens to be a green 6-foot-7-inch superpowered Hulk."
Rome,8.7,A down-to-earth account of the lives of both illustrious and ordinary Romans set in the last days of the Roman Republic.
The White Lotus,7.9,The exploits of various guests and employees of a tropical resort over the span of a week.
Fleabag,8.7,Series adapted from the award-winning play about a young woman trying to cope with life in London whilst coming to terms with a recent tragedy.
The Good Place,8.2,Four people and their otherworldly frienemy struggle in the afterlife to define what it means to be good.
Entourage,8.5,Film star Vince Chase navigates the vapid terrain of Los Angeles with a close circle of friends and his trusty agent.
Pretty Little Liars,7.4,"Four friends band together against an anonymous foe who threatens to reveal their darkest secrets, while also investigating the disappearance of their best friend."
One Punch Man,8.7,"The story of Saitama, a hero that does it just for fun & can defeat his enemies with a single punch."
BoJack Horseman,8.8,"BoJack Horseman was the star of the hit television show ""Horsin' Around"" in the '80s and '90s, but now he's washed up, living in Hollywood, complaining about everything, and wearing colorful sweaters."
Battlestar Galactica,8.7,"When an old enemy, the Cylons, resurface and obliterate the 12 colonies, the crew of the aged Galactica protect a small civilian fleet - the last of humanity - as they journey toward the fabled 13th colony, Earth."
Outlander,8.4,"Claire Beauchamp Randall, a nurse in World War II, mysteriously goes back in time to Scotland in 1743. There, she meets a dashing Highland warrior and gets drawn into an epic rebellion."
Castle,8.1,"After a serial killer imitates the plots of his novels, successful mystery novelist Richard ""Rick"" Castle receives permission from the Mayor of New York City to tag along with an NYPD homicide investigation team for research purposes."
Bones,7.8,"Forensic anthropologist Dr. Temperance ""Bones"" Brennan and cocky F.B.I. Special Agent Seeley Booth build a team to investigate murders. Quite often, there isn't more to examine than rotten flesh or mere bones."
The Heroes,8.4,The moral stories of a group of champions (Pahlevanan) living in Kharazm city in 13th century.
The Expanse,8.5,"The disappearance of rich-girl-turned-political-activist links the lives of Ceres detective, accidental ship captain and U.N. politician. Amidst political tension between Earth, Mars and the Belt, they unravel the greatest conspiracy."
Severance,8.7,"Mark leads a team of office workers whose memories have been surgically divided between their work and personal lives. When a mysterious colleague appears outside of work, it begins a journey to discover the truth about their jobs."
Archer,8.6,Covert black ops and espionage take a back seat to zany personalities and relationships between secret agents and drones.
The Sandman,7.7,"Upon escaping after decades of imprisonment by a mortal wizard, Dream, the personification of dreams, sets about to reclaim his lost equipment."
How to Get Away with Murder,8.1,A group of ambitious law students and their brilliant criminal defense professor become involved in a twisted murder plot that promises to change the course of their lives.
The IT Crowd,8.5,"The comedic misadventures of Roy, Moss and their grifting supervisor Jen, a rag-tag team of IT support workers at a large corporation headed by a hotheaded yuppie."
Sense8,8.2,"A group of people around the world are suddenly linked mentally, and must find a way to survive being hunted by those who see them as a threat to the world's order."
Silicon Valley,8.5,"Follows the struggle of Richard Hendricks, a Silicon Valley engineer trying to build his own company called Pied Piper."
Invincible,8.7,An adult animated series based on the Skybound/Image comic about a teenager whose father is the most powerful superhero on the planet.
Teen Wolf,7.7,An average high school student and his best friend get caught up in some trouble causing him to receive a werewolf bite. As a result they find themselves in the middle of all sorts of dramas in Beacon Hills.
The Last Kingdom,8.5,"As Alfred the Great defends his kingdom from Norse invaders, Uhtred--born a Saxon but raised by Vikings--seeks to claim his ancestral birthright."
Jack Ryan,8.0,"Up-and-coming CIA analyst, Jack Ryan, is thrust into dangerous field assignments."
NCIS,7.8,"The cases of the Naval Criminal Investigative Service's Washington, D.C. Major Case Response Team."
Buffy the Vampire Slayer,8.3,"A young woman, destined to slay vampires, demons and other infernal creatures, deals with her life fighting evil, with the help of her friends."
Bridgerton,7.4,The eight close-knit siblings of the Bridgerton family look for love and happiness in London high society. Inspired by Julia Quinn's best selling novels.
Glee,6.8,A group of ambitious misfits try to escape the harsh realities of high school by joining a glee club headed by a passionate Spanish teacher.
This Is Us,8.7,"A heartwarming and emotional story about a unique set of triplets, their struggles, and their wonderful parents."
One Piece,8.9,"Follows the adventures of Monkey D. Luffy and his pirate crew in order to find the greatest treasure ever left by the legendary Pirate, Gold Roger. The famous mystery treasure named ""One Piece""."
Riverdale,6.5,"While navigating the troubled waters of romance, school and family, Archie and his gang become entangled in dark Riverdale mysteries."
Scam 1992: The Harshad Mehta Story,9.3,"Set in 1980s and '90s Bombay, it follows the life of Harshad Mehta, a stockbroker who took the stock market to dizzying heights and his catastrophic downfall."
Luther,8.4,DCI John Luther is a near-genius murder detective whose brilliant mind can't always save him from the dangerous violence of his passions.
Freaks and Geeks,8.8,A high school mathlete starts hanging out with a group of burnouts while her younger brother navigates his freshman year.
After Life,8.4,"After Tony's wife dies, his nice-guy persona is altered into an impulsive, devil-may-care attitude that takes his old world by storm."
Reacher,8.1,Jack Reacher was arrested for murder and now the police need his help. Based on the books by Lee Child.
Taboo,8.3,"Adventurer James Keziah Delaney returns to London during the War of 1812 to rebuild his late father's shipping empire. However, both the government and his biggest competitor want his inheritance at any cost--even murder."
