Title,Rating,Overview
The Goop Lab,2.6,"Leading with curiosity, Gwyneth Paltrow and her goop team look at psychedelics, energy work and other challenging wellness topics."
The Professionals,8.0,"Bodie and Doyle, top agents for Britain's CI5 (Criminal Intelligence 5), and their controller, George Cowley fight terrorism and similar high-profile crimes. Cowley, a hard ex-MI5 operative...                See full summary »"
Detroit 1-8-7,7.6,The everyday trials and tribulations of Detroit's homicide unit.
Laugh-In,8.0,The original rapid fire sketch comedy show.
The Croods: Family Tree,6.8,It continues the evolving story of the croods and Bettermans as they learn to live together on the most idle farm in prehistory.
Badehotellet,7.9,"The seaside hotel ""Badehotellet"" in NW Denmark opens for its wealthy guests each summer. We follow the guests and staff at the hotel from 1928 and into the 1940s."
Limitless,8.0,"A different way we can live better for longer: regenerating damage, maximizing strength, building resilience, shocking the body, supercharging memory and confronting mortality."
The Test: A New Era for Australia's Team,8.8,"The Australian Mens Cricket Team has been rocked by a cheating scandal, and now they must rebuild their culture and reclaim their status as the world's number one side."
Cannon,6.8,"Frank Cannon, a husky ex-cop and culinary enthusiast, solves tough cases as a private investigator."
Yu-Gi-Oh! Duel Monsters,8.2,"Yu-Gi-Oh! follows the adventures of high school student Yugi, who has a magical secret that comes to life when he plays his favorite card game: 'Duel Monsters."
Class of 2020,5.3,"Class of 2020, is a coming of age teen drama revolving around a bunch of teenagers and their struggle as their lives are intertwined with drugs, relationships, sex and peer pressure."
My Own Worst Enemy,7.3,"Henry Spivey, an efficiency expert, lives a typical suburban life, right down to the wife, two kids, dog, and minivan. In contrast, Edward Albright is a lethal, multilingual operative. It ...                See full summary »"
Petticoat Junction,7.0,The misadventures of the family staff of The Shady Rest Hotel and their neighbors of Hooterville.
Trial by Media,7.1,"In our modern media landscape where real courtroom dramas have increasingly been transformed into a form of entertainment, this series reflects on some of the most dramatic and memorable trials in recent history."
Marry Me,6.3,"Annie and Jake finally get engaged after six years, but her larger-than-life personality and his laid-back approach to life will severely test the theory of ""opposites attract"". They quickly realize getting engaged was the easy part."
My Liberation Diary,8.3,"Three siblings, exhausted by the monotony of day-to-day adulthood, seek to find fulfillment and freedom from their humdrum lives."
Heartbreak High,7.8,A crash course in the turbulence of being a teen is always on the schedule for the students at Hartley High School in this 1990s series set in Sydney.
"Upstairs, Downstairs",8.4,"The lives and fortunes of the Bellamy family and their below-stairs servant staff at 165 Eaton Place play out against the social, political and historical backdrop of Edwardian London from 1903 to 1930."
Gåsmamman,7.5,Sonja lives a carefree life with her family near Stockholm and works as an accountant in the family business at the marina. One day Sonja is drawn into the criminal underworld to save her family.
Eisai to tairi mou!,8.4,"Stella is a fat Greek woman who lives in Australia. Vicky, is also Greek and lives in Australia, but she is a beautiful model. After she is engaged to Nikos, she takes the plane to Greece ...                See full summary »"
Free!,7.4,"Free! revolves around members of a high school boy's swimming team. Four boys-Haruka, Makoto, Nagisa and Rin-all participated in a swimming tournament shortly before graduating elementary ...                See full summary »"
Most Extreme Elimination Challenge,8.8,"A silly Japanese game show on which contestants are painfully eliminated through barely possible stunts and events, most taking place above pools of mud."
Poison,7.3,"Jaiveer is back as Aditya to take revenge from the JOSH team comprising Sara, Harsh and Oscar. Watch out for the mind games that follow."
No Man's Land,7.8,"A family grieves the death of their daughter in a suicide bombing. Meanwhile, her brother suspects she is still alive after glimpsing her in a news report and sets off to find her in the Middle East."
Wheel of Fortune,6.7,"Hosted by Pat Sajak, this game show features 3 contestants who try to solve a puzzle by spinning the wheel and guessing letters in a word or phrase."
Love to Hate You,7.9,"For an attorney who despises losing to men and an A-list actor who distrusts women, love means nothing - until they're forced to date each other."
Hidden Palms,6.7,A rebellious teenager moves with his family to Palm Springs.
Happy Town,7.0,A deputy sheriff is confronted with the unsolved mystery of a half-dozen child kidnappings over the past decade in a small town in Minnesota.
My Girlfriend Is a Gumiho,7.7,"Chae Dae Wong, an aspiring actor, unwillingly releases a Gumiho, a legendary nine-tailed fox, from her centuries-old prison. He runs away terrified and ends up injuring himself badly, but she saves his life and asks to stay by his side."
Dotted,6.5,"Ardal and Bamshad often get themselves in sticky situations that they try to hide from their wives, but they are always found out by the end of each episode."
Alvin & the Chipmunks,6.6,"Three chipmunk brothers, Alvin, Simon, and Theodore. The trio have been adopted by and are living with Dave (human). Each show finds the boys getting into trouble and new and unusual situations."
Sofia the First,6.9,Sofia is a little girl with a commoner's background until her mom marries the king and suddenly she is royalty.
Emmerdale Farm,4.9,A soap opera set in a fictional village in the Yorkshire Dales.
Around the World with Willy Fog,7.5,A furry version of Jules Verne's classic adventure story of a British gentleman's challenge to circumnavigate the world in 80 days.
The Bugs Bunny and Tweety Show,7.8,"Bugs Bunny, Tweety Bird, and all their cartoon friends, with the exception of Speedy Gonzales, are featured in this long-running series consisting of classic theatrical cartoons, often ...                See full summary »"
Expedition Unknown,8.2,An archeologist travels around the world looking for unknown and missing artifacts from throughout time.
"I'm a Celebrity, Get Me Out of Here!",5.8,"British reality series presented by Ant and Dec in which 12 celebrities are abandoned in the Australian jungle. In order to earn food, they must perform Bushtucker Trials which challenge them physically and mentally."
Fist of the North Star,8.2,"After a nuclear war turns Earth into a lawless wasteland, Kenshiro, a practitioner of the deadly master art ""Hokuto Shinken"", fights a succession of tyrannical warriors to restore order."
Mum,8.3,"After the death of her husband, a woman attempts to rebuild her life while surrounded by her sometimes problematic family and friends."
Wheeler Dealers,8.2,Car enthusiast Mike Brewer teams up with mechanics to repair and restore classic cars in order to resell them.
Bartu Ben,7.5,It tells the story of a 'less famous' becoming a little more famous.
ReGenesis,7.9,"Geneticist David Sandstrom is the chief scientist at the prestigious virology/micro-biology NORBAC laboratory, a joint enterprise between the USA, Canada and Mexico for countering bio-terrorism."
Dirk Gently,7.6,Holistic detective Gently relies on the universe to unravel mysteries based on the 'interconnectedness of all things'.
Word of Honor,8.5,Zhou Zi Shu gets embroiled in a conspiracy in the martial arts world. He meets Wen Ke Xing who escapes from the Ghost Valley to avenge his parents' deaths. They become fast friends and embark on an adventure to find a legendary treasure.
Sabka Sai,9.4,"A saint worshipped across India - Sai Baba has touched and enriched the lives of many. Highly anticipated amongst his followers, 'Sabka Sai', gives a glimpse into the life of the great Sufi...                See full summary »"
Superior Donuts,6.5,"Sympathetic old-school doughnut shop owner Arthur, his spunky young employee and aspiring artist, Franco, and their friends and patrons keep the shop going in a changing culturally-mixed inner city Chicago neighborhood."
Die Discounter,8.0,"A group of young supermarket employees faces the daily challenges of the store. Led by store manager Thorsten, the employees try to master all the disasters and dramas."
Dead Pixels,7.4,"Centres on three mates whose world revolves around their obsession for the fictional MMORPG Kingdom Scrolls, splitting between their real and virtual lives, and how they cross over."
LOL: Last One Laughing Germany,7.5,"In this comedy-gameshow, ten German comedians try to be the last one laughing. Make your opponents laugh, while staying serious yourself."
Who Were We Running From?,5.7,"Hiding a mysterious past, a mother lives like a nameless fugitive with her daughter as they make hotels their home and see everyone else as a threat."
Broad City,8.6,Broad City follows two women throughout their daily lives in New York City. This is the original web-series the hit Comedy Central TV-series is based off.
A besúgó,8.1,"In Communist Hungary in 1985, Geri is eager to start his first year of college. But his plans are interrupted when the State Security blackmails him into spying on Zsolt Száva, a radical pro-democracy leader."
"True Jackson, VP",5.9,"Impressed by her no-nonsense style as she sells sandwiches outside his offices, fashion executive Max impulsively offers teenager True Jackson a dream job as vice president in charge of his youth apparel line."
The Steppe,8.0,"In his profession, experienced captain Seyfi and rookie policeman Nuri Pamir face a child murder in the city. This murder leads them to the city's populated business man Abbas and his daughter Dilara."
Dave the Barbarian,7.0,"Follow the adventures of Dave, one incredibly unusual barbarian, who's more interested in raising his family and cooking yummy gourmet meals than conquering new lands."
B Positive,6.3,"Newly divorced dad Drew faces finding a kidney donor and is at the end of his rope and his hope when he runs into Gina, a rough-around-the edges woman from his past who volunteers her own."
Galactik Football,7.7,A new generation of once great team is ready to regain old glory in the amazing space football tournament.
Kryminalni,6.4,Add a Plot
Running Man,9.1,Running Man is a reality-variety show where the cast must complete missions at various places to win the race.
A Haunting,7.9,"An American paranormal anthology previewing stories told by the victims. Victims tell their terrifying encounters with the paranormal. This show contains narration, frightening re-enactments, and religious content."
Chapter 2,8.5,"Starting over is never an easy thing to do. So after his breakup with long time partner Kevin, Jonathan finds himself struggling to adjust to life as a single guy. His friends want him to ...                See full summary »"
Am I Being Unreasonable?,7.6,"Follows two friends who love having fun and booze, until everything unravels."
Hoarders,6.5,A reality-TV show that features compulsive hoarders--people who are addicted to filling their homes with objects--and how that spills out into their lives.
Harry Enfield and Chums,7.5,"The BBC sketch show that while continuing to show the misadventures of a series of popular characters now introduces a slew of new oddballs and misfits, including Tory Boy and The Lovely Wobbly Randy Old Ladies."
Is It Cake?,5.9,"Skilled cake artists create mouthwatering replicas of handbags, sewing machines and more in a mind-bending baking contest inspired by a popular meme."
No Good Nick,6.0,A family's lives are turned upside-down when a street-smart young grifter shows up on their doorstep claiming to be a distant relative.
Dark Side of the Ring,8.7,"From backstage controversies to mysterious deaths and unsolved homicides, this series explores the darkest stories from the golden age of professional wrestling, and tries to find truth at the intersection of fantasy and reality."
Guardians of the Galaxy,7.3,The adventures of a band of space warriors who work to protect the universe from the evil overlord Thanos.
Reckless,7.0,"In sultry Charleston, where summer is long and secrets simmer behind every door, sex and crime walk hand in hand as two adversaries, a gorgeous Yankee litigator and a southern City Attorney...                See full summary »"
See You in My 19th Life,8.0,"Ban Ji Eum has an extraordinary ability: she can remember the memories of all her past lives. Repeating her reincarnation for nearly a thousand years, Ban Ji Eum has been living her lives ...                See full summary »"
The High Fructose Adventures of Annoying Orange,1.9,A television series of the popular YouTube series ''Annoying Orange''. Where Orange (Dane Boedigheimer) goes on an adventure with his friends. His weird friend Nerville (Toby Turner) ...                See full summary »
The Apprentice UK,7.2,"20 young entrepreneurs compete in several business tasks, and must survive the weekly firings in order to become the business partner of one of the most successful businessmen."
Man Like Mobeen,8.0,"Mobeen is a 28-year old Brummie Muslim singlehandedly raising his 15-year-old sister. This show documents the struggles of his criminal past, the friendships he has, and the controversies he faces as a Pakistani Muslim."
Love Me,7.8,"Friendship, grief and romance intersect with love in the lives of three generations of people living in Stockholm."
Freddy's Nightmares,6.2,"Freddy, the dream serial killer, hosts this anthology of stories set in Springwood."
Property Brothers,7.1,They get a buyer that's a Vietnam veteran and his younger wife to buy a home in Florida who has big ideas for fixing it up under budget
NTSF:SD:SUV,7.3,"Never forget? Terrorism hasn't, and neither will the NTSF:SD:SUV. In a world where threatening danger looms large and Homeland Security won't secure itself, San Diego's citizens can't afford not to trust in the NTSF."
Angela Black,6.4,"Trapped in a relationship she cannot escape, Angela is approached out of the blue by Ed, a private investigator, who spills her husband's darkest secrets."
Back,7.3,Sitcom following estranged foster-brothers Stephen and Andrew as they vow to take over the family business following their father's death.
Grand Designs,8.5,"Kevin McCloud follows people as they build their dream house, often focusing on modern design, energy efficiency, maximizing space and views."
The Devil Judge,8.3,"During a time of chaos, a judge turns the court into something like a reality show and punishes evil people mercilessly."
Jinny's Kitchen,9.0,"Succeeding 'Youn's Kitchen', Lee Seo Jin will be running a new franchise restaurant abroad that specializes in Korean street food. The show features fellow actors Lee, Jung Yu-mi, Park Seo-joon, Choi Woo-shik and world star BTS V."
Trailer Park Boys: The Animated Series,7.5,"Nova Scotia's favorite miscreants have always been super sketchy. Now, carrying on from the Season 12 finale, the boys have become complete cartoons."
Clueless,5.7,"A follow-up to the blockbuster movie of the same name, following the rich teenager Cher and her friends as they attend high school in Beverly Hills."
Valor,6.0,A United States Army base serves as home to an elite unit of helicopter pilots trained to perform clandestine international and domestic missions.
The Invisible Man,7.4,"A thief and conman is given the means to become invisible, and ends up working for a government agency."
The Marked Heart,6.6,"Simón's wife was killed to extract her heart and transplant it to Camila, the wife of a rich man. In search of revenge, he dives into the dangerous world of organ trafficking."
Better with You,6.8,Two sisters are at different stages in their respective relationships.
The Wolf,7.8,"The script tells the story of Kuizhou City Princess Zhaixing and a young wolf cub who grew up in a wolf pack, and they met after missing eight years. The two fought for love and fate."
Vida,7.4,"Two sisters, who could not be more different or distanced from each other, are forced to move back to their childhood neighborhood, after the death of their mother, only to discover her past and the shocking truth about her identity."
Marasli,7.7,"Marasli (BurakDeniz) is a retired soldier turned bookstore owner. For Marasli, life changed drastically after his daughter is shot. One day, the beautiful Mahur (AlinaBoz) enters Marasli's ...                See full summary »"
Family Reunion,6.6,"When the McKellan family moves from Seattle to Georgia to be closer to extended family, the transition is like being a catfish out of water."
Snow White with the Red Hair,7.7,"Shirayuki was a young girl born with unique apple-red hair. She meets a famous but foolish Prince Raji, who falls in love with her at first sight and orders her to become his concubine. ...                See full summary »"
Below Deck Mediterranean,7.6,A reality show following the crew and Captain of a luxury charter yacht in the Mediterranean.
Saint Seiya: The Hades Chapter - Sanctuary,8.5,"Hades is planning to take over the world, to achieve that goal, he sends out deceased Gold Saints to take Athena's head. Seiya and the other Bronze Saints come to help but their help isn't ...                See full summary »"
Dragon Age: Absolution,6.4,"Set in the Tevinter Empire, the oldest of several human nations in Thedas explore the experiences of its different inhabitants."
The Astronaut Wives Club,7.3,"Based on Lily Koppel's best-selling titular novel, which tells the real story of the women who stood beside some of the biggest heroes in American history during the height of the space race."
Bad Boy Billionaires: India,7.9,"This investigative docuseries explores the greed, fraud and corruption that built up - and ultimately brought down - India's most infamous tycoons."
InuYasha: The Final Act,8.5,"InuYasha's story draws to a close but not before finding Naraku and the Sacred Jewel, and facing new enemies and new dangers."
He's Expecting,3.1,"When a successful ad executive who's got it all figured out becomes pregnant, he's forced to confront social inequities he'd never considered before."
Rake,6.8,An outspoken and self-destructive criminal defense lawyer takes on the most challenging cases.
X Company,7.7,"Set in the thrilling and dangerous world of WWII, follows the stories of five highly skilled young recruits, torn from their ordinary lives to train as agents in an ultra-secret facility."
Citizen Khan,6.3,Comedy series set in Birmingham following the trials and tribulations of (self appointed) community leader Mr Khan and his family.
Hey Dude,7.2,A group of friends work together with their boss at a dude ranch and go through many fun moments and mishaps along the way.
Cars on the Road,7.0,Lightning McQueen and Mater go on a cross-country road trip to see Mater's sister.
The Crimson Field,7.8,"During the First World War, Kitty Trevelyan tries to put the past troubles behind her as she joins two other girls to volunteer at one of the busy war hospitals in northern France."
1001 Nights,5.3,"Sehrazat, a young widow who is financially unable to treat her terminally ill young son, is forced to address to her charming boss, asking for help. The proposal by her boss changes her life forever."
Walker: Independence,6.9,"Abby Walker's husband is murdered before her eyes. On her quest for revenge, Abby crosses paths with Hoyt Rawlins. Abby and Hoyt's journey takes them to Independence, Texas, where they encounter residents running from their own pasts."
The Big Valley,7.6,The Wild West adventures of the Barkley family in California's San Joaquin Valley.
Ingobernable,7.0,"The first lady of Mexico is a woman of conviction and ideals. But when she loses faith in her husband, she'll need all her strength to uncover the truth."
Steptoe and Son,7.8,"British sitcom about a father-and-son rag-and-bone business in London. The intergenerational divide between the miserly Steptoe and his ambitious son results in comedy, drama, and tragedy."
The A List,5.5,"Mia arrives at an idyllic summer camp expecting to be Queen Bee, but the ""holiday of a lifetime"" turns into a twisted nightmare."
Ramyug,5.6,Movie is adaptation of the epic Ramayana.
Doctor Doctor,7.8,A rising heart surgeon's life takes a turn he never expected and soon everything comes crashing down. He soon finds himself a former big city doctor turned small town doctor.
China Beach,8.2,"The trials of a weary nurse, her friends and colleagues in a Vietnam War field hospital."
Fixer Upper,8.1,"Chip and Joanna Gaines take on clients in the Waco Texas area, turning their fixer uppers into the homes of their dreams."
Silverhawks,7.3,A team of cyborgs protects Limbo from Mon Star and his gang.
OK K.O.! Let's Be Heroes,6.8,"An enthusiastic young boy earns a job at a hero supply store and trains to become the ""Greatest Hero Ever."""
Telenovela,6.9,"Comedy that goes behind the scenes of a telenovela and its star, whose off-camera life rivals the drama of her onscreen story lines."
The Upshaws,7.0,It centers on a working-class African American family in Indiana struggling to make it work and make it right without any blueprints.
Dual Survival,7.4,"Experts agree there are some very basic - and universal - rules for surviving in the wild. Find shelter, find water, find food, find help. Beyond that, there's not much they agree on. Meet ...                See full summary »"
Bee and PuppyCat,8.2,"Bee, an unemployed woman, is living a normal life until a grumpy companion named PuppyCat arrives. Follow Bee and and PuppyCat as they travel between reality and ""Fishbowl Space."""
Last Chance U: Basketball,8.3,Explore an honest and gritty look inside the world of community college basketball.
Formula 1,9.4,Formula One is the highest class of single-seat auto racing that is supervised by the Fédération Internationale de l'Automobile (FIA).
One Spring Night,7.9,"A couple in their 30s has dated for many years. When they begin to discuss marriage, they begin to look upon their relationship in a different light."
Lights Out,8.0,A former heavyweight boxing champion struggles to find his identity after retiring from the ring.
The Lizzie Bennet Diaries,8.8,"A modern day retelling of Pride and Prejudice, the series is told in vlog-style by Lizzie Bennet as she narrates the trials and tribulations of her family life with the help of her best ...                See full summary »"
Cake Boss,6.6,"The staff of Carlo's Bakery in Hoboken, New Jersey, led by Buddy Valastro, shows how it prepares elaborate themed cakes for various occasions. Each episode typically features the ...                See full summary »"
Full Swing,8.0,"Follows behind the scenes of what it takes to compete and win at the highest levels in men's professional golf, following the PGA players through their wins and losses."
Dream High,7.6,Six dedicated students at Kirin Art High School work to achieve their dreams of becoming stars in the Korean music industry.
Wisdom of the Crowd,6.6,"A tech innovator creates a cutting-edge crowd-sourcing hub to solve his own daughter's murder, as well as revolutionizing crime solving in San Francisco."
The Steve Harvey Show,6.6,A former funk star named Steve Hightower enlists as a high school music teacher away from his original career in Chicago.
Merlí. Sapere Aude,7.7,"When Pol enrolls in university in pursuit of a philosophy degree, he's challenged and enticed by new friends and an intimidating professor."
Life as We Know It,7.8,"See life through the eyes of Dino, Ben, and Jonathan -- three teens experiencing the joys and pains of growing up. Although different in many ways, these guys have one main thing in common -- women."
Luna Nera,6.0,A group of women are suspected of witchcraft in 17th century Italy.
Fixerr,5.3,"One mistake - and an ATS officer from Delhi turns a fixer for Mumbai movie mafias and industrialists. Soon he finds himself stuck in a dangerous cycle. To end this game of crime, he decides...                See full summary »"
The Mole,7.6,It follows twelve players as they work together in challenges to add money to a pot that only one of them will win.
Osmosis,5.8,"In near future Paris, a dating app matches singles with their soulmates by mining their brain data, but decoding true love comes at a price."
The Eminence in Shadow,7.8,"Cid Kagenou creates an elaborate plot to fight the Cult of Diabolos and builds his organization, the Shadow Garden."
Bad and Crazy,8.0,A heroic drama that follows capable but bad cop Ryoo Soo-yeol regaining his humanity after meeting the righteous but crazy 'K'.
Eek! The Cat,7.2,"The comical misadventures of Eek, a kind-hearted anthropomorphic purple cat who finds himself in constant mortal danger while trying to help others. The show had two more segments - The Terrible Thunderlizards and Klutter."
United States of Al,6.5,"The friendship between Riley, a Marine combat veteran struggling to readjust to civilian life in Ohio, and Awalmir, the Afghan interpreter who served with his unit and has just arrived to start a new life in America."
Louis Theroux's Weird Weekends,8.5,"Louis Theroux documents some of the US's most bizarre happenings, events and rituals, by getting involved himself."
Moriarty the Patriot,8.0,"William James Moriarty lives as a regular noble while also being a consultant for the common folk to solve their problems. However, deep inside him lies a desire to destroy the current structure that dominates British society."
The Legend of Tarzan,6.7,The further adventures of the jungle hero Tarzan (1999) and his friends.
